{
    "schema":  "codex-praetor-release-intent/v1",
    "product":  "codex-praetor",
    "version":  "0.16.5-alpha",
    "previous_version":  "0.16.4-alpha",
    "tag":  "v0.16.5-alpha",
    "release_required":  true,
    "release_mode":  "auto_on_main",
    "artifact":  "codex-praetor-setup-0.16.5-alpha.zip",
    "reason":  "修复 Windows PowerShell UTF-8 BOM 使有效 plan ledger 被能力画像误判为 malformed 的共同静态证据断点；只纠正只读解析，不重写历史账本、不提升旧尝试、不扩大 provider、任务族或自动路由承诺。"
}
